neighborhood,area,year,room,deposit,rent,floor,elavator,parking,warehouse,city,post_type,post_time,link
ف و چمخاله,https://divar.ir/v/-/QZpNKGPX
,۸۰,۱۴۰۲,۲,۳٬۵۰۰٬۰۰۰٬۰۰۰ تومان,۱۵٬۶۲۵٬۰۰۰ تومان,,پارکینگ,انباری,بالکن ندارد,زیباکنار,فروش خانه و ویلا,دقایقی پیش در زیباکنار,https://divar.ir/v/-/QZsBEmTN
,,,,توافقی,,,,,,ماسال,فروش زمین و کلنگی,دقایقی پیش در ماسال,https://divar.ir/v/-/QZwBm20H
,۴۰,۱۳۸۸,بدون اتاق,,,,,,,بندر انزلی,اجارهٔ مغازه و غرفه,دقایقی پیش در بندر انزلی,https://divar.ir/v/-/QZw50fin
معلم,,,,۶۱۵٬۰۰۰٬۰۰۰ تومان,۴٬۲۴۱٬۰۰۰ تومان,,,,,رشت,فروش زمین و کلنگی,دقایقی پیش در رشت، معلم,https://divar.ir/v/-/QZ1gkCE_
,,,,۳۶۰٬۰۰۰٬۰۰۰ تومان,۱٬۵۰۶٬۰۰۰ تومان,,,,,چاف و چمخاله,فروش زمین و کلنگی,دقایقی پیش در چاف و چمخاله,https://divar.ir/v/-/QZkBaJEw
